Token Name,Token Code,News Title,News URL,news
Gluwa Credit,G-CRE,Gluwa (@Gluwa) / X,https://twitter.com/gluwa?lang=en,Big news! The @Creditcoin explorer is officially live! Get ready for exciting ... Gluwa is empowering financial inclusion with. @Azure. In. @Microsoft. 's ...
Gluwa Credit,G-CRE,Gluwa,https://gluwa.com/,"Now, you can invest in exciting fintechs driving financial inclusion, all whilst earning yields of up to 20% APR. Underpinning all of this is the Creditcoin ..."
Gluwa Credit,G-CRE,Gluwa Pushing for Crypto Policy Framework in Collaboration With ...,https://cryptonews.net/news/legal/20853993/,"Apr 20, 2023 ... As of now, Gluwa has created the first blockchain-based credit ... Download the Crypto News app and get news about crypto and blockchain from ..."
Dai Stableco,DAI,"Stablecoins: Definition, How They Work, and Types",https://www.investopedia.com/terms/s/stablecoin.asp,"For example, MakerDAO's Dai (DAI) stablecoin is pegged to the U.S. dollar ... News · Privacy Policy · Contact Us · Careers; Your Privacy Choices. # · A · B · C ..."
Dai Stableco,DAI,Stablecoins See Positive Supply Growth For First Time in More Than ...,https://cryptonews.com/news/stablecoins-see-positive-supply-growth-for-first-time-in-more-than-a-year-glassnode-data.htm,"Nov 15, 2023 ... Cryptonews Altcoin News Stablecoins See Positive Supply Growth For ... (DAI), has turned noticeably positive, marking first such instance ..."
Dai Stableco,DAI,SwapRouter | Address ...,https://goerli.etherscan.io/address/0xe592427a0aece92de3edee1f18e0157c05861564,"... News visit cointelgraph.live to CLAIM · CYBERX (CYBERX). 100 CYBERX · DAI (DAI). 9.32915686 DAI · Dai (DAI). 13,475,644,806,504.2 DAI · Dai Stableco... (DAI)."
Compound USD,cUSDC,"Investigational compound remdesivir, developed by UAB and NIH ...",https://www.uab.edu/news/health/item/11082-investigational-compound-remdesivir-developed-by-uab-and-nih-researchers-being-used-for-treatment-of-novel-coronavirus,"Feb 7, 2020 ... Investigational compound remdesivir, developed by UAB and NIH researchers, being used for treatment of novel ..."
Compound USD,cUSDC,"Compound USD Coin CUSDC Price, Live Charts, and News in ...",https://www.coinbase.com/price/compound-usd-coin,"Get the latest price, news, live charts, and market trends about Compound USD Coin. The current price of Compound USD Coin in ..."
Compound USD,cUSDC,States threaten crackdown on copycat versions of Ozempic and ...,https://www.nbcnews.com/health/health-news/ozempic-wegovy-weight-loss-compounded-crackdowns-rcna82405,"May 3, 2023 ... ... News that the warnings do not mean compounding semaglutide is banned. ... used for scientific research but not intended ..."
Sai Stableco,SAI,Review of carbon dioxide utilization technologies and their potential ...,https://www.sciencedirect.com/science/article/pii/S2212982022003584,"〈https://www.aramco.com/en/news-media/news/2016/acquires-novomers-polyol ... Sai Prasad, J.W. Bae, K.W. Jun, K.W. Lee. Fischer–Tropsch synthesis by carbon ..."
Sai Stableco,SAI,bneiluj.eth | Address ...,https://etherscan.io/address/0xa7499aa6464c078eeb940da2fc95c6acd010c3cc,Sai Stableco... (SAI). 0.4199 SAI. $5.10. @12.15 · YFI. yearn.financ... (YFI) ... rekt.news - hacks &amp;amp; hopium. RHH. x2ERC-721 · SeoulStars. SeoulStars.
Sai Stableco,SAI,Build a Decentralized Lending App With Compound | by Tai | ICOVO ...,https://medium.com/icovo/build-a-decentralized-lending-app-with-compound-ede3c17adcc1,"Dec 1, 2019 ... The goal of this post is to build a simple application that lends Sai and withdraws it with interests. You can see the finished code here."
Aave Token,AAVE,Aave - Open Source Liquidity Protocol,https://aave.com/,Aave is an Open Source Protocol to create Non-Custodial Liquidity Markets to earn interest on supplying and borrowing assets with a variable or stable ...
Aave Token,AAVE,Aave Protocol (@aaveaave) / X,https://twitter.com/aaveaave?lang=en,"All things Aave Protocol. Joined November 2023. 4 Following · 1,855 Followers · Posts · Replies · Media · Likes. Aave Protocol's posts. Pinned."
Aave Token,AAVE,"Aave price today, AAVE to USD live price, marketcap and chart ...",https://coinmarketcap.com/currencies/aave/,Aave is a decentralized finance protocol that allows people to lend and borrow crypto. Lenders earn interest by depositing digital assets into specially ...
SushiToken,SUSHI,Sushi.com (@SushiSwap) / X,https://twitter.com/sushiswap?lang=en,Chefs from all rollups will benefit from unified liquidity across Ethereum. https://news.omni.network/sushi-integrates-with-the-open-liquidity-network/… 11. 28.
SushiToken,SUSHI,Sushi,https://www.sushi.com/,"A Decentralised Finance (DeFi) app with features such as swap, cross chain swap, streaming, vesting, and permissionless market making for liquidity ..."
SushiToken,SUSHI,"SushiSwap SUSHI Price, Live Charts, and News in United States",https://www.coinbase.com/price/sushiswap,The price of SushiSwap has decreased by 0.06% in the last hour and increased by 2.19% in the past 24 hours. SushiSwap's price has also risen by 4.91% in the ...
EthereumMax,eMax,EthereumMax (@ethereum_max) / X,https://twitter.com/ethereum_max?lang=en,"EthereumMax ✪'s posts. Pinned ... Join the exclusive early access newsletter & get real-time alerts for project updates, events, exclusive offers, news, & more!"
EthereumMax,eMax,EthereumMax: Disrupt History,https://ethereummax.org/,EMAX Treasury. Arbitrum 0x5EA06A2bE857D35D5E545b2bF54b2d387bB8B4bA ; Contract Address. Mainnet Layer 1 0x15874d65e649880c2614e7a480cb7c9A55787FF6 ; EMAX Expense ...
EthereumMax,eMax,What Is EthereumMax? Inside the Crypto Kim Kardashian Lost $1.2 ...,https://www.coindesk.com/business/2022/10/03/what-is-ethereummax-inside-the-crypto-kim-kardashian-lost-12m-promoting/,"Oct 3, 2022 ... EthereumMax and the EMAX token won investors over with big promises and flashy names. ... The leader in news and information on cryptocurrency, ..."
1INCH Token,1INCH,1inch Network | Leading high capital efficient DeFi protocols,https://1inch.io/,1INCH token. A token that facilitates 1inch protocol governance and participation in the network's evolution. 1INCH token. Learn more ...
1INCH Token,1INCH,1inch Network (@1inch) / X,https://twitter.com/1inch?lang=en,"1/ ⚡️ Exciting news for #1inchWallet users on #Android! Update 1.20 brings ... Integration When selecting and using 1inch for token swaps on Velvet, you ..."
1INCH Token,1INCH,1inch Network Blog,https://blog.1inch.io/,"1inch Network Blog | Web 3, DeFi & Crypto news. Products. dApp Wallet ... 1inch DAO 1INCH token Forum. Support. Help center Press room Bug report by Hacker one."
Maker,MKR,Maker News DIY Projects for Makers - Make: DIY Projects and Ideas ...,https://makezine.com/category/maker-news/,Maker News · Join Our Live Stream To See Maker Fashion At New York Fashion Week · Review: Acmer Laser A2 IR Laser Module · Making Blender Do Things That CAD Can ...
Maker,MKR,"GameMaker Blog: News, Articles & Expert Tutorials | GameMaker",https://gamemaker.io/en/blog,"Visit the GameMaker blog for all the latest news and announcements. Learn how to use GameMaker, catch up on the latest updates, and learn about game ..."
Maker,MKR,"Family Tree Maker News, Offers and Other Emails",https://support.mackiev.com/078081-Family-Tree-Maker-News-Offers-and-Other-Emails,"Sep 21, 2020 ... Family Tree Maker News, Offers and Other Emails · Newsletters and special offers: ftm-news @ mackiev.com · Live chat transcripts and support ..."
Synthetix Ne,SNX,Synthetix,https://synthetix.io/,"Synthetix is a derivatives liquidity protocol providing the backbone for derivatives trading in DeFi, allowing anyone, anywhere to gain on-chain exposure to ..."
Synthetix Ne,SNX,Synthetix Deploys First Major Perpetuals Protocol on Base Mainne ...,https://panhandle.newschannelnebraska.com/story/50378467/synthetix-deploys-first-major-perpetuals-protocol-on-base-mainnet-marking-the-completion-of-the-synthetix-v3-upgrade,"Jan 24, 2024 ... Synthetix is a leading crypto derivatives markets ecosystem powered by the Synthetix protocol. ... PANHANDLE - NEWS CHANNEL NEBRASKA. KSID-FM KSID ..."
Synthetix Ne,SNX,Synthetix ⚔️ (@synthetix_io) / X,https://twitter.com/synthetix_io?lang=en,"A new financial primitive enabling the creation of synthetic assets, offering unique derivatives and exposure to real-world assets on the blockchain. #DeFi."
Curve DAO To,CRV,Curve Finance (@CurveFinance) / X,https://twitter.com/curvefinance?lang=en,... Curve crvUSD stableswap LPs that earn up to 18.61% APY at current rates. See ... DL News · @DLNewsInfo. ·. Feb 2. How Conic Finance drew $26m in just three days ...
Curve DAO To,CRV,Curve DAO Price Prediction 2023: What is Curve DAO (CRV)?,https://www.ccn.com/curve-dao-crv-price-prediction/,"Oct 13, 2023 ... Curve DAO price predictions suggest the CRV token can reach $1.06 this year and $1.83 in 2025. To find out more, read on."
Curve DAO To,CRV,Curve DAO agrees to $44m compensation for July hack victims – DL ...,https://www.dlnews.com/articles/defi/curve-votes-44-million-usd-in-crv-tokens-for-lp-hack-victims/,"Dec 22, 2023 ... Conversely, their compensation may end up eclipsing initial losses if CRV experiences a price rally. Disclaimer: The two co-founders of DL News ..."
Compound Eth,cETH,Compound,https://compound.finance/,"Compound is an algorithmic, autonomous interest rate protocol built for developers, to unlock a universe of open financial applications."
Compound Eth,cETH,Compound becomes latest DeFi protocol to go live on Base | The ...,https://www.theblock.co/post/244921/compound-defi-base,"Aug 15, 2023 ... DeFi lending platform Compound is the latest protocol to launch on Coinbase's new Ethereum Layer 2 network Base."
Compound Eth,cETH,Morpho unseats Compound to become second-biggest DeFi lender ...,https://www.dlnews.com/articles/defi/morpho-flips-compound-as-defi-lender-on-ethereum/,2 days ago ... Ryan Celaj is DL News' New York-based Data Correspondent. Reach out with tips at ryan@dlnews.com. Related Topics. MORPHOETHEREUMAAVECOMPOUND ...
hoge.finance,HOGE,$HOGE,https://www.reddit.com/r/hoge/,HOGE Finance : Official Update Report. Upvote 8. Downvote 2 comments ... Report. News · No news long time · QUESTION. Upvote 12. Downvote 6 comments. Share ...
hoge.finance,HOGE,HOGE (@HogeFinance) / X,https://twitter.com/hogefinance?lang=en,A deflationary auto-rewarding unchangeable smart contract that provides a blockchain built DeFi sandbox for everyone to meme the business eternally.
hoge.finance,HOGE,"Hoge Finance (HOGE) Price Today, News & Live Chart | Forbes ...",https://www.forbes.com/digital-assets/assets/hoge-finance-hoge/,"Browse the latest Hoge Finance (HOGE) cryptocurrency news, research, and analysis. Stay informed on Hoge Finance prices within the cryptocurrency market."
Immutable X,IMX,Immutable (@Immutable) / X,https://twitter.com/Immutable,Immutable is the leading platform for building web3 games on Ethereum. Powering the next generation of web3 games #onImmutable https://t.co/nTJWjmsagX.
Immutable X,IMX,"Immutable Blog | Immutable updates, announcements and sneak ...",https://www.immutable.com/blog,"Read the latest web3 stories and news from Immutable, including updates, announcements and sneak peeks ... Immutable X. Optimized game-specific ZK-rollup."
Immutable X,IMX,Immutable X Price Prediction 2024 | CCN.com,https://www.ccn.com/analysis/immutablex-imx-price-prediction/,8 days ago ... Can IMX cash in on this news? One Immutable X price prediction says it can reach $6.89 next year. Billed as a Web3 gaming platform to power NFTs ...
Merchant Tok,MTO,TikTok Struggles to Enlist U.S. Merchants for Shopping Service ...,https://www.theinformation.com/articles/tiktok-struggles-to-enlist-u-s-merchants-for-shopping-service,"Apr 10, 2023 ... TikTok Shop is so far barring foreign merchants from selling in the U.S. • As of last month, fewer than 100 U.S. sellers were selling on TikTok ..."
Merchant Tok,MTO,TikTok Ban Threat Scares Off US Merchants - PYMNTS.com,https://www.pymnts.com/news/retail/2023/tiktok-ban-threat-scares-off-u-s-merchants/,"Apr 10, 2023 ... This latest news comes on the heels of reports last week that ad spending on TikTok had grown by 11% despite the threat of government action by ..."
Merchant Tok,MTO,"Trader Joe's sold out of kimbap, its latest viral offering, thanks to TikTok",https://www.nbcnews.com/news/asian-america/trader-joes-kimbap-tiktok-rcna103403,"Sep 6, 2023 ... This is great news for a more authentic Korean experience through a Korean grocer like H Mart to really benefit off of something that Trader ..."
yearn.financ,YFI,Yearn Finance says faulty script wiped out $1.4 million from treasury ...,https://www.theblock.co/post/267483/yearn-finance-says-faulty-script-wiped-out-63-of-treasury,"Dec 13, 2023 ... Keep up with the latest news, trends, charts and views on crypto and DeFi with a new biweekly newsletter from The Block's Frank Chaparro. By ..."
yearn.financ,YFI,"yearn.finance (YFI) Price Today, News & Live Chart | Forbes Crypto ...",https://www.forbes.com/digital-assets/assets/yearn.finance-yfi/,Learn what yearn.finance (YFI) cryptocurrency is and today's market price. Confidently invest in cryptocurrency with current and historical yearn.finance ...
yearn.financ,YFI,Did Yearn Finance insiders dump on holders? Not really – DL News,https://www.dlnews.com/articles/defi/yearn-finance-token-craters-after-dydx-market-manipulation/,"Nov 21, 2023 ... Numerous traders attributed the YFI token drop to a potential rug pull by insiders at Yearn Finance. But that wasn't the case."
Balancer,BAL,Balancer Labs (@balancerlabs) / X,https://twitter.com/balancerlabs?lang=en,Balancer Labs contributes to @Balancer Protocol Join Discord: https://t.co/XgH37DKe8h.
Balancer,BAL,Balancer Depositors Pull Nearly $100M in Crypto After Vulnerability ...,https://www.coindesk.com/markets/2023/08/22/balancer-depositors-pull-nearly-100m-in-crypto-after-vulnerability-warning/,"Aug 22, 2023 ... Balancer, which supports trading of ether and other tokens with user ... The leader in news and information on cryptocurrency, digital assets ..."
Balancer,BAL,Balancer DeFi Liquidity Protocol,https://balancer.fi/,"Build DeFi liquidity: Applications, integrations, pools and incentives."
Illuvium,ILV,News - Illuvium,https://illuvium.io/news,"Illuvium, the world's first IBG (Interoperable Blockchain Game) is an upcoming open-world exploration, NFT creature collector and autobattler game built on ..."
Illuvium,ILV,Illuvium (@illuviumio) / X,https://twitter.com/illuviumio,"Official account for Illuvium Game Studio | Explore, Capture, Collect and Fight for ETH in the Illuvium Universe. Linktree: https://t.co/GLZBWsL36X."
Illuvium,ILV,Illuvium,https://illuvium.io/,"Illuvium, the world's first IBG (Interoperable Blockchain Game) is an upcoming open-world exploration, NFT creature collector and autobattler game built on ..."
HyperDao,HDAO,HyperDAO Official (@Hdao_Official) / X,https://twitter.com/Hdao_Official,"... consensus. HyperDAO Embrace the New Age of Decentralization. Image. 2. 259 · HyperDAO Official · @Hdao_Official. ·. Nov 21, 2023. HyperDAO Daily News ✍ ."
HyperDao,HDAO,"HyperDAO HDAO Price, Live Charts, and News in United States",https://www.coinbase.com/price/hyperdao,"Get the latest price, news, live charts, and market trends about HyperDAO. The current price of HyperDAO in United States is $0.000230 per (HDAO / USD)"
HyperDao,HDAO,"HyperDAO (HDAO) Price Today, News & Live Chart | Forbes Crypto ...",https://www.forbes.com/digital-assets/assets/hyperdao-hdao/,Learn what HyperDAO (HDAO) cryptocurrency is and today's market price. Confidently invest in cryptocurrency with current and historical HyperDAO market ...
StargateToke,STG,Technical Analysis of Wrapped Ether / StargateToken ...,https://www.tradingview.com/symbols/WETHSTG/technicals/?exchange=UNISWAP3ETH,Overview News Ideas. Technicals. Markets. WETHSTG technical analysis. This gauge displays a real-time technical analysis overview for your selected timeframe ...
StargateToke,STG,Stargate Finance – STG Utilization: Fee Reduction / Sustainable ...,https://commonwealth.im/stargatetoken/discussion/4558-stg-utilization-fee-reduction-sustainable-token-burn,Newest. Include comments flagged as spam. Anonymous. •. 9 months ago. i loved the idea . great news. 0. Share. Basala. •. 9 months ago. This ok news. 0. Share.
StargateToke,STG,STGUSDC Market Data from Major Exchanges — TradingView,https://www.tradingview.com/symbols/STGUSDC/markets/,Overview News Ideas Technicals. Markets. StargateToken / USD Coin (CALCULATED BY TRADINGVIEW) exchanges. Get StargateToken / USD Coin (CALCULATED BY ...
Spell Token,SPELL,"Spell Token price today, SPELL to USD live price, marketcap and ...",https://coinmarketcap.com/currencies/spell-token/,"The live Spell Token price today is $0.000518 USD with a 24-hour trading volume of $4,616,966 USD. We update our SPELL to USD price in real-time. Spell Token is ..."
Spell Token,SPELL,‍♂️ (@MIM_Spell) / X,https://twitter.com/mim_spell?lang=en,"Borrow, Leverage or Earn Yield. Enjoy the Magic #Wizard. $MIM $SPELL Discord: https://t.co/mi8POGJUaH."
10Set Token,10SET,Tenset Price: 10SET Live Price Chart & News | CoinGecko,https://www.coingecko.com/en/coins/tenset,"The price of Tenset (10SET) is $0.6932 today with a 24-hour trading volume of $382,718.27. This represents a 3.03% price increase in the last 24 hours and a ..."
10Set Token,10SET,TenseT.io (@TenseT_io) / X,https://twitter.com/TenseT_io,"to discuss the latest at #10SET, upcoming #Alvara IDO and the current crypto market! Exclusive server only for TGLP Genesis NFT holders, join https:// ..."
10Set Token,10SET,Tenset | Technological hub specialising in Blockchain,https://www.tenset.io/en/,"News · Contact. Connect ... By locking 10set in Infinity, you get daily drops from tens of different crypto projects on the platform, including the 10set token."
SuperFarm,SUPER,"SuperFarm Price Prediction | 2022, 2023, 2024-2030",https://changelly.com/blog/superfarm-price-prediction/,"SuperFarm is an NFT platform that has its own native token, SUPER. Today, we will be looking at our SuperFarm price prediction for 2022-2030."
SuperFarm,SUPER,"SuperFarm (SUPER) Live Tokenomics, Charts, Ratings & News ...",https://tokeninsight.com/en/coins/superfarm/tokenomics,SuperFarm is a cross-chain DeFi protocol designed to bring utility to any token by turning it into a NFT farm with no code required. With an innovative suite of ...
SuperFarm,SUPER,SuperFarm price prediction: can it make NFTs mainstream?,https://capital.com/superfarm-super-price-prediction,"Jan 18, 2022 ... According to SuperFarm's website, the project is a “a cross-chain DeFi protocol designed to bring utility to any token by turning it into an NFT ..."
BZZ,BZZ,BuzzFeed News | Breaking News | Original Reporting | News Analysis,https://www.buzzfeednews.com/,"BuzzFeed News has breaking stories and original reporting on politics, world news, social media, viral trends, health, science, technology, entertainment, ..."
BZZ,BZZ,FTC Charges Deceptive Privacy Practices in Googles Rollout of Its ...,https://www.ftc.gov/news-events/news/press-releases/2011/03/ftc-charges-deceptive-privacy-practices-googles-rollout-its-buzz-social-network,"Mar 30, 2011 ... ... Buzz, in 2010. The agency alleges the practices violate the FTC Act ... News · Events · Features · Topics · Data and Visualizations · Contests ..."
BZZ,BZZ,Bridgewater Buzz News,https://bridgewater.blog/,Excavation Work Continues on Riverwalk Extension. The extension of Riverwalk through Bridgeview Park is progressing quickly! Much of the path has been excavated ...
Aave interes,aSTETH,Aave - Open Source Liquidity Protocol,https://aave.com/,Aave is an Open Source Protocol to create Non-Custodial Liquidity Markets to earn interest on supplying and borrowing assets with a variable or stable ...
Aave interes,aSTETH,Matic Aave Interest Bearing AAVE Price: MAAAVE Live Price Chart ...,https://www.coingecko.com/en/coins/matic-aave-aave,"Track the latest Matic Aave Interest Bearing AAVE price, market cap, trading volume, news and more with CoinGecko's live MAAAVE price chart and popular ..."
Aave interes,aSTETH,"Aave interest bearing USDC aUSDC Price, Live Charts, and News ...",https://www.coinbase.com/price/aave-interest-bearing-usdc,"Get the latest price, news, live charts, and market trends about Aave interest bearing USDC. The current price of Aave interest bearing USDC in United ..."
The Force To,FOR,Forces News - YouTube,https://www.youtube.com/@forces_news,The latest military tech · Play all · Royal Marines' new and improved Commando Raiding Craft · The weapons a Type 45 destroyer has in her arsenal to fend off ...
The Force To,FOR,"Air Force Times, Independent News For Airmen | Air Force Times",https://www.airforcetimes.com/,Air Force Times is your independent voice for news about airmen at home and deployed around the world.
The Force To,FOR,News,https://www.af.mil/News/,"The official website of the U.S. Air Force. AF.MIL delivers the latest breaking news and information on the U.S. Air Force including top stories, features, ..."
AllianceBloc,ALBT,AllianceBlock (@allianceblock) / X,https://twitter.com/allianceblock?lang=en,AllianceBlock Nexera - News. AllianceBlock is building the infrastructure for a decentralized tokenized market. $NXRA Join our official community: t.me ...
AllianceBloc,ALBT,What is the Pacific Alliance? – Alianza del Pacífico.,https://alianzapacifico.net/en/what-is-the-pacific-alliance/,News · Photos/Images · Videos · Newsletters · Contact. What is the Pacific Alliance? The Pacific Alliance is an initiative of regional integration comprised by ...
AllianceBloc,ALBT,India's opposition alliance to boycott 'hate-filled' TV news anchors ...,https://www.aljazeera.com/news/2023/9/15/indias-opposition-alliance-to-boycott-hate-filled-tv-news-anchors,"Sep 15, 2023 ... India's opposition alliance to boycott 'hate-filled' TV news anchors. Congress-led alliance accuses some anchors of partisanship towards PM ..."
Convex Token,CVX,Convex Finance (@ConvexFinance) / X,https://twitter.com/convexfinance?lang=en,"Convex will not post any links after this tweet. Links below this tweet that look like Convex are spam, fake or phishing links. Do not click any link under ..."
Convex Token,CVX,Convex,https://www.convexfinance.com/,"Convex is a platform that boosts rewards for CRV stakers and liquidity providers alike, all in a simple and easy to use interface."
Convex Token,CVX,DeFi Tool Convex to Make Changes to Staking Service for Curve ...,https://www.coindesk.com/tech/2023/01/04/defi-tool-convex-to-make-changes-to-staking-service-for-curve-token-rewards/,"Jan 4, 2023 ... Curve tokens (CRV) are issued as yield farming rewards to liquidity providers on Curve Finance, and can be converted into vote-escrowed CRV ..."
Nimbus,NBU,News & Events – Nimbus,https://www.nimbustx.com/news-events/,"Press Releases · January 05, 2024. Nimbus Therapeutics Announces Expansion of Its Immunology Drug Discovery Pipeline · December 18, 2023 · October 31, 2023."
Nimbus,NBU,"Fresh off $4B deal, Nimbus gears up for 'third chapter' with new ...",https://www.biopharmadive.com/news/nimbus-venture-financing-hpk1-tyk2-cancer/692762/,"Sep 6, 2023 ... Fresh off $4B deal, Nimbus gears up for 'third chapter' with new fundraise ... email. BioPharma Dive news delivered to your inbox. Get the free ..."
Nimbus,NBU,Nimbus,https://www.nimbustx.com/,Pipeline & Targets / · Pipeline & Targets Overview · Our Pipeline · Nimbus Programs · Acquired Programs · Publications & Presentations · News & ...
Rocket Bunny,BUNNY,Georgia student's Rocket Bunny cryptocurrency explodes to over $1 ...,https://www.dailymail.co.uk/news/article-9708841/Georgia-students-Rocket-Bunny-cryptocurrency-explodes-1trillion-Coinbase-glitch.html,"Jun 21, 2021 ... A nursing student in Georgia woke up to find the $20 he invested in the cryptocurrency Rocket Bunny exploded in value to over $1trillion due to ..."
Rocket Bunny,BUNNY,Rocket Bunny duckbill wing without kit | 2023+ Nissan Z Forum ...,https://www.nissanzclub.com/forum/threads/rocket-bunny-duckbill-wing-without-kit.1879/,"May 9, 2023 ... 2023+ Nissan Z Forum, Community, Owners, News, Discussions (RZ34) ... Rocket Bunny duckbill wing without kit. Thread starter Maximus; Start date ..."
Rocket Bunny,BUNNY,Pandem Rocket Bunny Does Inexplicable Things To New Toyota ...,https://www.motor1.com/news/538300/rocket-bunny-toyota-gr86-kit/,"Oct 4, 2021 ... There's also a version in the livery of the tuner Cusco. GR 86 News: 2022 toyota gr86 first drive 2022 Toyota GR 86 First Drive ..."
Compound Dai,cDAI,"Compound Dai CDAI Price, Live Charts, and News in United States",https://www.coinbase.com/price/compound-dai,"Get the latest price, news, live charts, and market trends about Compound Dai. The current price of Compound Dai in United States is $0.0227 per (CDAI ..."
Compound Dai,cDAI,Compound,https://compound.finance/,"Compound is an algorithmic, autonomous interest rate protocol built for developers, to unlock a universe of open financial applications."
Compound Dai,cDAI,Worries remain after neo-Nazi sells Maine compound,https://www.bangordailynews.com/2023/11/06/news/penobscot/maine-neo-nazi-worries-christopher-pohlhaus/,"Nov 6, 2023 ... Bangor Daily News. Maine news, sports, politics, election results ... The neo-Nazi compound in Springfield has been sold, but leaders of ..."
