Token Name,Token Code,News Title,News URL,news
Staked Olymp,sOHM,Stakes rise in USA Olympic conflict >> Scuttlebutt Sailing News,https://www.sailingscuttlebutt.com/2024/01/30/stakes-rise-in-usa-olympic-conflict/,"Stakes rise in USA Olympic conflict. Published on January 30th, 2024. While USA athletes need to focus on preparing for the Paris 2024 Olympics, ..."
Staked Olymp,sOHM,What's at Stake for Trump at the Winter Olympics | The New Yorker,https://www.newyorker.com/news/news-desk/whats-at-stake-for-trump-at-the-korean-olympics,"Feb 8, 2018 ... ... news agency. “Explicitly speaking, we have no intention to meet with the U.S. side. . . . Our delegation's visit to South Korea is only to ..."
Staked Olymp,sOHM,'Claims could run into billions': the interests at stake if Olympics in ...,https://www.theguardian.com/sport/2021/jun/10/claims-could-run-into-billions-the-interests-at-stake-if-olympics-in-japan-were-cancelled,"Jun 10, 2021 ... IOC officials have avoided any mention of the commercial forces driving the Tokyo Games towards their 23 July opening date."
SwissBorg,CHSB,SwissBorg (@swissborg) / X,https://twitter.com/swissborg?lang=en,SwissBorg · @swissborg. ·. Feb 7. Exciting News: @XBorgHQ. 's $XBG Presale is coming soon! Get ready to be part of the XBorg gaming revolution. With ...
SwissBorg,CHSB,Invest in crypto assets the smart way SwissBorg,https://swissborg.com/,Join thousands of smart users and start investing with the SwissBorg app at the best available price anywhere at any time.
SwissBorg,CHSB,SwissBorg - making crypto asset management accessible to everyone,https://www.reddit.com/r/swissborg/,"r/swissborg: SwissBorg app: Invest in 60+ cryptocurrencies easily, automate returns, and diversify with expertly managed bundles. Earn without…"
Frax Share,FXS,Frax Finance,https://frax.finance/,Frax Price Index Share (FPIS) is a utility token that can be staked as veFPIS to uniquely govern the FPI stablecoin's novel CPI peg properties. FPIS is ...
Frax Share,FXS,Frax Finance ¤⛓️¤ (@fraxfinance) / X,https://twitter.com/fraxfinance?lang=en,It's time for the Fraxtal launch thread! The most important & consequential release since the dawn of Frax itself in 2020. Fraxtal testnet & mainnet are ...
Frax Share,FXS,"Frax Share price today, FXS to USD live price, marketcap and chart ...",https://coinmarketcap.com/currencies/frax-share/,"The live Frax Share price today is $9.05 USD with a 24-hour trading volume of $32,616,865 USD. We update our FXS to USD price in real-time. Frax Share is down ..."
Elite Swap,ELT,"Elite Swap ELT Price, Live Charts, and News in United States",https://www.coinbase.com/price/elite-swap,"Get the latest price, news, live charts, and market trends about Elite Swap. The current price of Elite Swap in United States is $NaN per (ELT / USD)"
Elite Swap,ELT,"Elite Swap price today, ELT to USD live price, marketcap and chart ...",https://coinmarketcap.com/currencies/elite-swap/,Elite Swap news ... Elite Swap is Complete Fork of Uniswap With Defi Dashboard and Multichain Swap Protocol.
Elite Swap,ELT,"Bondurant billionaire buys 'elite enclave' up Greys River, eyes land ...",https://wyofile.com/bondurant-billionaire-buys-elite-enclave-up-greys-river-eyes-land-swap/,"Feb 24, 2023 ... Bondurant billionaire buys 'elite enclave' up Greys River, eyes land swap ... Latest News. Ranch owner's lawyer off corner-crossing case, now with ..."
Akropolis,AKRO,Akropolis | Earn DeFi Yield on Autopilot,https://www.akropolis.io/,Akropolis uses cookies in order to enhance user experience. You can learn more ... Once a week we will send you our latest news. Subscribe. By providing your ...
Akropolis,AKRO,Akropolis (@akropolisio) / X,https://twitter.com/akropolisio?lang=en,"Akropolis · @akropolisio. ·. Jun 28, 2023. The news you were waiting for - @LiquityProtocol integration is live Big thanks to the @MetaLamp_Web3 team who ..."
Akropolis,AKRO,"Akropolis (AKRO) Price Today, News & Live Chart | Forbes Crypto ...",https://www.forbes.com/digital-assets/assets/akropolis-akro/,Akropolis Price & News · Akropolis (akro) Price Conversion Calculator · Akropolis Resources · About Akropolis · Akropolis & Other Cryptocurrencies · Historical ...
DefiPulse In,DPI,Defi Pulse Index,https://indexcoop.com/products/defi-pulse-index,"The DeFi Pulse Index (DPI) is a capitalization-weighted index that tracks the ... news feeds, tutorials, tweets, and videos. Before you make any financial ..."
DefiPulse In,DPI,DeFi - Decentralized Finance,https://www.reddit.com/r/defi/,"r/defi: News, articles and discussions about decentralized financial protocols on any blockchain."
DefiPulse In,DPI,2023's top 5 DeFi protocols by revenue - Blockworks,https://blockworks.co/news/top-defi-protocols-by-revenue,"Dec 25, 2023 ... TVL has begun to fall out of favor, so which metric can be used to rank this year's top DeFi projects? ... News · Podcasts · Newsletter · Events."
pSTAKE Finan,PSTAKE,pSTAKE | Unlocking liquidity of staked assets,https://pstake.finance/,"pSTAKE, developed by Persistence, is a liquid staking protocol unlocking the liquidity of staked assets. Stakers of PoS tokens can stake their assets while ..."
pSTAKE Finan,PSTAKE,"pSTAKE Finance (PSTAKE) Price Today, News & Live Chart ...",https://www.forbes.com/digital-assets/assets/pstake-finance-pstake/,Learn what pSTAKE Finance (PSTAKE) cryptocurrency is and today's market price. Confidently invest in cryptocurrency with current and historical pSTAKE ...
pSTAKE Finan,PSTAKE,pSTAKE Finance Price: PSTAKE Live Price Chart & News | CoinGecko,https://www.coingecko.com/en/coins/pstake-finance,"Results 1 - 10 of 20 ... The price of pSTAKE Finance (PSTAKE) is $0.0428 today with a 24-hour trading volume of $929,369.92. This represents a -0.32% price decline ..."
Zks,ZKS,ZKS | News & Resources,https://zkslaw.com/news/,Categories ... The 38th Annual Zimmerman Kiser Sutcliffe Moot Co ... Continue reading · ZKS Named a 2023 Top Workplace in Orland ... ... ZKS Law is honored to have ...
Zks,ZKS,"ZKSpace ZKS Price, Live Charts, and News in Germany",https://www.coinbase.com/en-de/price/zkswap,"Get the latest price, news, live charts, and market trends about ZKSpace. The current price of ZKSpace in Germany is €0.0571 per (ZKS / EUR)"
Zks,ZKS,News and Events Archives - ZKS,https://zkslaw.com/category/news-and-events/,"Categories. Categories. Select Category, COVID-19 Updates, Firm News, News, News and Events, Uncategorized. Search for: ZKS LAW premieres new name, brand messag ..."
Clover,CLV,Clover news Archives - Clover Blog,https://blog.clover.com/tag/clover-news/,Clover news · Fiserv deepens Clover and BentoBox integration to unify restaurant operations · Restaurants can streamline order management with new Clover ...
Clover,CLV,Sad news about CloverBBY – Clover Food Lab,https://www.cloverfoodlab.com/sad-news-about-cloverbby/,"I'm writing to share some news: we've decided to permanently close CloverROW, our outpost in the Assembly Row neighborhood of Somerville. The closure of this ..."
Clover,CLV,Clover news - Clover Blog,https://blog.clover.com/clover-news/,"Clover Named Restaurant Smart Terminal Provider of the Year. BROOKFIELD, Wis., December 11, 2020 – Clover® from Fiserv, Inc. (NASDAQ: FISV), a leading provider ..."
swETH,swETH,Seth (@sethrogen) • Instagram photos and videos,https://www.instagram.com/sethrogen/,"In other news, The Marble Rolling Set from Houseplant. Photo by Seth on September 11, 2023. Photo shared by Houseplant on September 08, 2023 tagging ..."
swETH,swETH,Seth Voorhees — Multimedia Journalist,https://spectrumlocalnews.com/nys/rochester/reporters/2020/01/06/seth-voorhees,"Jan 6, 2020 ... After seven years in local radio, Seth's TV reporting career began in 1995 in the Spectrum News 1 Rochester newsroom. ... Just two years later, ..."
swETH,swETH,Seth Rogen (@Sethrogen) / X,https://twitter.com/sethrogen?lang=en,"I'm so thrilled to be a part of bringing this wild R rated comedy to the world. Enjoy the trailer for Joy Ride, in theaters July 7th! Embedded video."
GeroWallet,GERO,GeroWallet (@GeroWallet) / X,https://twitter.com/gerowallet?lang=en,Another Cardano ADA News Update with a focus on Project Catalyst & external funding sources for Cardano projects & start ups. https://learncardano.io/podcasts/ ...
GeroWallet,GERO,GeroWallet - Your Master Key to DeFi,https://gerowallet.io/,Stake your ADA to the GERO stake pool and earn ADA and $GERO in rewards. Built-In Swap. Swap ADA and any Cardano native assets directly within the wallet.
GeroWallet,GERO,"GeroWallet GERO Price, Live Charts, and News in United States",https://www.coinbase.com/price/gerowallet,"Get the latest price, news, live charts, and market trends about GeroWallet. The current price of GeroWallet in United States is $0.0053 per (GERO / USD)"
E-RADIX,eXRD,Radix - Radically Different DeFi (@radixdlt) / X,https://twitter.com/radixdlt?lang=en,Radix Wallet Update Android & iOS Wallet v1.4.0 Now Available This is a significant update to the network staking experience in the Radix Wallet.
E-RADIX,eXRD,Radix DLT | Radically Better Web3,https://www.radixdlt.com/,A decentralized network with the radically better user & developer experience needed for everyone to confidently use Web3 & DeFi.
E-RADIX,eXRD,"e-Radix EXRD Price, Live Charts, and News in United States",https://www.coinbase.com/price/radix,"Get the latest price, news, live charts, and market trends about e-Radix. The current price of e-Radix in United States is $0.0408 per (EXRD / USD)"
BarnBridge G,BOND,SEC commissioner disagrees with agency's BarnBridge DAO fine,https://crypto.news/sec-commissioner-diagrees-agency-barnbridge-dao-fine/,"Dec 23, 2023 ... Get crypto analysis, news and updates right to your inbox! Sign up here so you don't miss a single newsletter. Email Subscribe. You have ..."
BarnBridge G,BOND,Crypto Assets and Cyber Enforcement Actions - SEC.gov,https://www.sec.gov/spotlight/cybersecurity-enforcement-actions,... BarnBridge's offer and sale of structured crypto asset securities known as SMART Yield bonds. ... G-Coins or G-Dollars. The respondents have agreed to pay more ...
BarnBridge G,BOND,BarnBridge DAO votes to adhere to SEC ruling,https://crypto.news/barnbridge-dao-votes-to-adhere-to-sec-ruling/,"Oct 12, 2023 ... Get crypto analysis, news and updates right to your inbox! Sign up here so you don't miss a single newsletter. Email Subscribe. You have ..."
PAID Network,PAID,"PAID Network price today, PAID to USD live price, marketcap and ...",https://coinmarketcap.com/currencies/paid-network/,"PAID Network news ... PAID Network is up 11.57% in the last 24 hours. The current CoinMarketCap ranking is #709, with a live market cap of $25,307,064 USD. It ..."
PAID Network,PAID,PAID NETWORK (@paid_network) / X,https://twitter.com/paid_network?lang=en,Our mission is to provide highly vetted projects and founders bringing brilliant ideas with crowd-sourced funding https://t.co/1CGShpOWOx ...
PAID Network,PAID,Paid Network | Home,https://paidnetwork.com/,"Paid Network is home to Ignition, where our mission is to link vetted founders' ideas to crowd-funding and provide expert guidance to realize their vision."
Bidao,BID,Bidao® Smart Chain (@Bidaochain) / X,https://twitter.com/bidaochain?lang=en,HUGE News: We are going live on the Bidao Smartchain Mainnet this year You ... Massive News from the Bidao Coding Cave!!! It has been really productive in ...
Bidao,BID,"Bidao BID Price, Live Charts, and News in United States",https://www.coinbase.com/price/bidao,"Get the latest price, news, live charts, and market trends about Bidao. The current price of Bidao in United States is $0.0014 per (BID / USD)"
Bidao,BID,"Bidao price today, BID to USD live price, marketcap and chart ...",https://coinmarketcap.com/currencies/bidao/,"Sep 29, 2020 ... Bidao is a multi-chain decentralized finance (DeFi) platform and stablecoin. It is the first trustless stablecoin pegged to the U.S. dollar ..."
Lattice Toke,LTX,Lattice Gateway (@LatticeExchange) / X,https://twitter.com/LatticeExchange,"Lattice is the Gateway to Constellation's web3 ecosystem where projects can launch tokens, raise & manage liquidity. Users can vote, swap tokens & earn ..."
Lattice Toke,LTX,"Lattice Token LTX Price, Live Charts, and News in United States",https://www.coinbase.com/price/lattice-token,"The current price is $0.11 per LTX with a 24-hour trading volume of $25.60K. Currently, Lattice Token is valued at 95.69% below its all time high of $2.55. This ..."
Lattice Toke,LTX,Lattice Price: LTX Live Price Chart & News | CoinGecko,https://www.coingecko.com/en/coins/lattice-token,"lattice-token. Chains. Ethereum Ecosystem. Categories. DWF Labs Portfolio ... Get the latest crypto news, updates, and reports by subscribing to our free ..."
APY Governan,APY,"Target Corporation: News, Careers, Investors, Sustainability ...",https://corporate.target.com/,"From sustainability to jobs, you can expect more from Target. Learn about our history, values and mission."
APY Governan,APY,"NCAA adopts interim name, image and likeness policy - NCAA.org",https://www.ncaa.org/news/2021/6/30/ncaa-adopts-interim-name-image-and-likeness-policy.aspx,"Jun 30, 2021 ... ... Governance · Infractions Process · Recruiting · Archived Stories. Media Center. Home · News · Features · NCAA Social ..."
APY Governan,APY,Green News: Apply to the “Project Governance Graduate Fellowship ...,https://www.spc.int/updates/blog/did-you-know/2023/10/green-news-apply-to-the-project-governance-graduate-fellowship,"Oct 29, 2023 ... Apply to the PROJECT Governance Graduate Fellowship program! The PROJECT Governance Graduate Fellowship program ..."
UnFederalRes,eRSDL,« Regards sur une crise » avec Benoît Frydman – lacademie.tv,https://lacademie.tv/conferences/regards-sur-une-crise-avec-benoit-frydman,"Nov 19, 2020 ... Journée d'étude participative et citoyenne 2022 « Désinformation & fake news ». 96 min. Situations de l'euthanasie en Belgique et en France ..."
Perpetual,PERP,VMware by Broadcom Dramatically Simplifies Offer Lineup and ...,https://news.vmware.com/company/vmware-by-broadcom-business-transformation,"Dec 11, 2023 ... Skip to content · News & Stories. Search VMware News & Stories. Company. Corporate News ... perpetual licenses. Customers will be able to purchase ..."
Perpetual,PERP,Perpetual Dual-Class Stock: The Case Against Corporate ... - SEC.gov,https://www.sec.gov/news/speech/perpetual-dual-class-stock-case-against-corporate-royalty,"Feb 15, 2018 ... Perpetual Dual-Class Stock: The Case Against Corporate Royalty, speech by Commissioner Robert Jackson, Jr ... News · Press Releases · Speeches and ..."
Perpetual,PERP,Water-splitting module a source of perpetual energy | Rice News ...,https://news.rice.edu/news/2020/water-splitting-module-source-perpetual-energy,"May 4, 2020 ... 'Artificial leaf' concept inspires Rice University research into solar-powered fuel production ... HOUSTON – (May 4, 2020) – Rice University ..."
Wrapped sGaa,wsGaas,The SaGa Community,https://www.reddit.com/r/SaGa/,"r/SaGa: Subreddit for Squaresoft's long-running SaGa series. Comments, strategy, help requests, and news about this confusing and rewarding series…"
Wrapped sGaa,wsGaas,Wrapping up 2023! – JKMosaic,https://jkmosaic.com/wrapping-up-2023/,"Dec 12, 2023 ... During the second half of September, I taught at the Gem5 Conference in Whitewater, WI and then at the SAMA/SGAA conference in Buffalo, NY."
Wrapped sGaa,wsGaas,SAGA,https://www.reddit.com/r/sagathegame/,... Tribune and some archers at some point. r/sagathegame - More or less wrapped up painting my Republican Romans for SAGA. Upvote 29. Downvote 2 comments. Share ...
Oraichain To,ORAI,Oraichain (@oraichain) / X,https://twitter.com/oraichain?lang=en,Building your AI-powered home base for Web3 Enabled by #AI Oracle + #LLM Layer Personalized via DeFi Lens + AI Agents ⛓ Secured w/ Trustworthy ...
Oraichain To,ORAI,"Oraichain (ORAI) Price Today, News & Live Chart | Forbes Crypto ...",https://www.forbes.com/digital-assets/assets/oraichain-orai/,"Find Oraichain (ORAI) cryptocurrency prices, market news, historical data, and financial information. Make informed investment decisions with Oraichain ..."
Oraichain To,ORAI,News – Oraichain,https://blog.orai.io/tagged/news,"Read writing about News in Oraichain. Oraichain is the world's first intelligent and secure solution for emerging Web3, scalable Dapps, and decentralized ..."
Hashflow,HFT,hashflow (@hashflow) / X,https://twitter.com/hashflow?lang=en,hashflow's posts ; Crypto Miners · @CryptoMiners_Co · Feb 7. 🎙️ ; Wormhole 虫洞中文 · @wormholechina · Feb 7. 无缝的、原生的从 EVM 到. @solana ; DEGEN NEWS · @ ...
Hashflow,HFT,"Hashflow (HFT) Price Today, News & Live Chart | Forbes Crypto ...",https://www.forbes.com/digital-assets/assets/hashflow-hft/,"3 days ago ... Browse the latest Hashflow (HFT) cryptocurrency news, research, and analysis. Stay informed on Hashflow prices within the cryptocurrency ..."
Hashflow,HFT,Hashflow 2.0: Best Prices. Deep Liquidity. Every Token.,https://www.hashflow.com/,"Hashflow is a multichain decentralized exchange (DEX) that enables users to trade digital assets on leading blockchains including Ethereum, Arbitrum, ..."
PEAKDEFI,PEAK,PEAKDEFI - A decentralized asset management fund,https://peakdefi.com/,... PEAK token. February 2020. Creation of the PEAKDEFI [PEAK] token on the Ethereum blockchain and listing on three exchanges. March 2021. PEAKDEFI enters ...
PEAKDEFI,PEAK,West Ham United announce partnership with PEAKDEFI | West Ham ...,https://www.whufc.com/news/west-ham-united-announce-partnership-peakdefi,"May 9, 2022 ... Latest News. Last chance for UK Express Delivery. Hurry to shop in ... To learn more about PEAKDEFI and their products please head to peakdefi.com."
PEAKDEFI,PEAK,"PEAKDEFI PEAK Price, Live Charts, and News in United States",https://www.coinbase.com/price/peakdefi,The price of PEAKDEFI has decreased by 0.00% in the last hour and decreased by 2.19% in the past 24 hours. PEAKDEFI's price has also fallen by 8.55% in the past ...
Ondo,ONDO,Ondo Finance (@OndoFinance) / X,https://twitter.com/ondofinance?lang=en,"Ondo Finance's posts. Pinned. Square profile picture ... The news follows explosive growth for Sui's, with its TVL tripling since mid-December ..."
Ondo,ONDO,Ondo Cerezo Picks Up Win as AAMU Falls to MTSU - Alabama A&M ...,https://aamusports.com/news/2024/2/4/womens-tennis-ondo-cerezo-picks-up-win-as-aamu-falls-to-mtsu.aspx,5 days ago ... ... News Archives · In the News. Department. Accolades & Honors · Athletics ... Ondo Cerezo Picks Up Win as AAMU Falls to MTSU. Story Links. Final ...
Ondo,ONDO,Ondo State Government,https://ondostate.gov.ng/,"State News · Investment Opportunities · Lucky Orimisan Aiyedatiwa · Executive Governor of Ondo State · @LuckyAiyedatiwa · On 27 December 2023, Aiyedatiwa was sworn ..."
Renq Finance,RENQ,RenQ Finance (@RenQ_Finance) / X,https://twitter.com/renq_finance?lang=en,"RenQ connects all blockchains & establish a cross-chain asset exchange network, providing all necessary support for the DeFi ecosystem. Financial Tech Company ..."
Renq Finance,RENQ,"Renq Finance RENQ Price, Live Charts, and News in United States",https://www.coinbase.com/price/renq-finance,"Get the latest price, news, live charts, and market trends about Renq Finance. The current price of Renq Finance in United States is $0.0081 per (RENQ ..."
Renq Finance,RENQ,"Renq Finance price today, RENQ to USD live price, marketcap and ...",https://coinmarketcap.com/currencies/renq-finance/,... you take certain actions such as signing up and transacting with these affiliate platforms. Please refer to Affiliate Disclosure. Renq Finance news ...
Metaverse In,MVI,Will the Metaverse save journalism? | by Thomas Seymat | Medium,https://medium.com/@tseymat/will-the-metaverse-save-journalism-a4ce044c948e,"Oct 28, 2021 ... The Metaverse will save journalism if: · If the industry approaches this new concept, no matter the shape it takes, thoughtfully and manages to ..."
Metaverse In,MVI,"Metaverse | Latest News, Photos & Videos | WIRED",https://www.wired.com/tag/metaverse/,"Find the latest Metaverse news from WIRED. See related science and technology articles, photos, slideshows and videos."
Metaverse In,MVI,Metaverse News & Latest Stories | Metaverse Insider,https://metaverseinsider.tech/,AppliedVR and Kernel Flow Announce Clinical Results Evaluating how Brain Changes During Virtual Reality Treatment of Chronic Pain · Disney's $1.5 Billion ...
Orion Protoc,ORN,Orion Protocol Loses $3M of Crypto in Trading Pool Exploit,https://www.coindesk.com/business/2023/02/02/orion-protocol-loses-3m-of-crypto-in-trading-pool-exploit/,"Feb 2, 2023 ... Crypto trading venue Orion Protocol was set to pause operations Thursday after an apparent attacker drained millions of dollars worth of ..."
Orion Protoc,ORN,Orion (@orion_protocol) / X,https://twitter.com/orion_protocol?lang=en,"Orion. @orion_protocol. http://x.com/TradeOnOrion. Joined October 2023. 1 ... @orion_protocol hasn't posted. When they do, their posts will show up here."
Orion Protoc,ORN,OrionProtocol,https://www.reddit.com/r/OrionProtocol/,"r/OrionProtocol: Built on the most advanced liquidity aggregator ever developed, Orion Protocol aggregates the liquidity of every single crypto…"
AICRYPTO,AIC,"Latest AI, Crypto News Headlines for June 26, 2023",https://www.linkedin.com/pulse/latest-ai-crypto-news-headlines-june-26-2023-lewis-e-farrell,"Jun 26, 2023 ... Latest AI, Crypto News Headlines for June 26, 2023 · Lewis E. Farrell · Farrell's AI Crypto News. 1,377 follower. + Subscribe."
AICRYPTO,AIC,C3 AI - Enterprise AI,https://c3.ai/,C3 AI is a leading enterprise AI software provider for building enterprise-scale AI applications and accelerating digital transformation.
AICRYPTO,AIC,"Latest AI, Crypto News Headlines for November 10, 2023",https://www.linkedin.com/pulse/latest-ai-crypto-news-headlines-november-10-2023-lewis-e-farrell-zndnc?trk=public_post,"Nov 10, 2023 ... Latest AI, Crypto News Headlines for November 10, 2023 · Lewis E. Farrell · Farrell's AI Crypto News. 1,287 follower. + Subscribe."
Yield Protoc,YIELD,DeFi Lending Project Yield Protocol to Wind Down by Year's End,https://www.coindesk.com/business/2023/10/04/defi-project-yield-protocol-to-wind-down-by-years-end/,"Oct 4, 2023 ... ... Yield Protocol,"" Yield said. ... Sign up for Crypto Long & Short, our weekly newsletter featuring insights, news and analysis for the professional ..."
Yield Protoc,YIELD,Yield Protocol to permanently 'wind down' operations by December ...,https://cointelegraph.com/news/yield-protocol-permanently-wind-down-december-2023,"Oct 4, 2023 ... ... News. Collect article. Own this piece of history as an NFT. Join us on social networks. Decentralized finance (DeFi) lending protocol Yield ..."
Yield Protoc,YIELD,Fixed rate-focused Yield Protocol is the latest DeFi project to wind ...,https://blockworks.co/news/yield-protocol-defi-project-shutter-fixed-rate-platform,"Oct 3, 2023 ... Yield Protocol's X account announced that the protocol would “wind down. ... News · Podcasts · Newsletter · Events · Webinars · Research · Sitemap ..."
KEEP Token,KEEP,"Keep Network KEEP Price, Live Charts, and News in United States",https://www.coinbase.com/price/keep-network,"One of Keep Network's first products is an Ethereum token that represents 1 Bitcoin, called tBTC. Keep Network enables users to deposit Bitcoin and redeem ..."
KEEP Token,KEEP,Keep #tBTC (@keep_project) / X,https://twitter.com/keep_project?lang=en,Keep is building infrastructure for autonomous private data on public ... token to 20+ blockchains. Read how. ⬇️. Wormhole logo. Threshold Case Study ...
KEEP Token,KEEP,Keep Network,https://keep.network/,Threshold is live. Upgrade your KEEP and/or NU tokens to the new T token. Start Now · Mint · Faq · Press; About.
Spotted Turt,ST,News - Spotted Turtle focus of new grant,https://www.mass.gov/news/spotted-turtle-focus-of-new-grant,"Mar 1, 2018 ... Once listed as a Species of Special Concern under the Massachusetts Endangered Species Act, Spotted Turtles were removed from the list in 2006 ..."
Spotted Turt,ST,Wildlife Watch: Scientists try to spot the rare spotted turtle,https://www.wcax.com/2022/08/02/wildlife-watch-scientists-try-spot-rare-spotted-turtle/,"Aug 2, 2022 ... SOUTHERN VERMONT ( ..."
Spotted Turt,ST,Species Spotlight! Spotted Turtle! - Turtle Survival Alliance,https://turtlesurvival.org/news/species-spotlight-spotted-turtle/,"News & Events. Species Spotlight! Spotted Turtle! · Common name: Spotted Turtle · Countries of origin: United States of America · Habitat: Swamps, marshes, small, ..."
Strike Token,STRK,Strike Finance (@StrikeFinance) / X,https://twitter.com/strikefinance?lang=en,"We're proposing to add the crvUSD token from Curve Finance as a stable token market to Strike Protocol. With crvUSD, users can enjoy a collateralized ..."
Strike Token,STRK,"Strike price today, STRK to USD live price, marketcap and chart ...",https://coinmarketcap.com/currencies/strike/,"When a user deposits tokens to a Strike market, they receive sTokens in return. These sTokens represent the individual's stake in the pool and can be used to ..."
Strike Token,STRK,Strike - Most Trusted Decentralized Finance Platform,https://strike.org/,"Strike is your gateway to decentralized finance where you can explore exceptional APY rates across various token markets, including wstETH. Get in touch!"
