Token Name,Token Code,News Title,News URL,news
RAMP DEFI,RAMP,SEC Ramp Up Means Increased Enforcement Coming to Crypto ...,https://www.akingump.com/en/insights/alerts/sec-ramp-up-means-increased-enforcement-coming-to-crypto-platforms-defi-exchanges-and-nfts,"May 6, 2022 ... SEC Ramp Up Means Increased Enforcement Coming to Crypto Platforms, DeFi Exchanges and NFTs ... news/press-release/2022-78?utm_medium ..."
RAMP DEFI,RAMP,Ramp | Web3 financial infrastructure | Buy & sell crypto,https://ramp.network/,Allow users to buy and sell crypto without leaving your app or wallet. Buy and sell crypto directly on our website.
Pendle,PENDLE,Pendle news from the Lancashire Telegraph,https://www.lancashiretelegraph.co.uk/news/pendle/,"Breaking news for Pendle from the borough's daily newspaper, the Lancashire Telegraph."
Pendle,PENDLE,Pendle Latest News | Burnley Express,https://www.burnleyexpress.net/topic/pendle,Pendle · The Keirby Hotel being built in Burnley in 1958. Credit: Lancashire County Council. · Pendle Rise shopping centre in Nelson. Big projects lined up for ...
Pendle,PENDLE,Pendle Today | Burnley,https://www.facebook.com/pendletoday/,"Pendle Today, Burnley, Lancashire. 6984 likes · 1049 talking about this · 10 were here. Daily news, sport and community news from across Pendle."
Flux,FLUX,"News & Events : Flux Power Holdings, Inc. (FLUX)",https://ir.fluxpower.com/news-events,News & Events · Recent News View All News · Flux Power Reports Fiscal Year 2024 Second Quarter Financial Results · Flux Power to Participate in the Future of ...
Flux,FLUX,"Flux Power Holdings, Inc. (FLUX) Stock Price, News, Quote ...",https://finance.yahoo.com/quote/FLUX/,"Flux Power Holdings (NASDAQ:FLUX) adds US$8.4m to market cap in the past 7 days, though investors from three years ago are still down 71%. It is a pleasure to ..."
Flux,FLUX,Flux-Web3 Cloud (@RunOnFlux) / X,https://twitter.com/runonflux?lang=en,"Explore the latest from decentralized Flux Cloud! FluxCore, the innovative solution for AI compute challenges, is now live. Discover how Proof of Useful ..."
