Token Name,Token Code,News Title,News URL,news
pNetwork Tok,PNT,TikTok to be blocked from parliamentary devices and network over ...,https://news.sky.com/story/tiktok-to-be-blocked-from-all-parliamentary-devices-over-cyber-security-fears-12840887,"Mar 23, 2023 ... TikTok will be blocked from parliament's devices and network - though ... Sky News: Breaking, UK & World. Sky UK Limited. FREE - In Google Play."
pNetwork Tok,PNT,"Tokenplace TOK Price, Live Charts, and News in United States",https://www.coinbase.com/price/tokenplace,"TOK is the native token of the Tokenplace network. TOK token is an ERC-20 standard token and offers various benefits to its holders, such as a lower ..."
pNetwork Tok,PNT,Current Weather - The Weather Network,https://www.theweathernetwork.com/en/city/us/alaska/tok/current,"Get Tok, AK. current weather report with temperature, feels like, wind ... News. Read more news."
Uquid Coin,UQC,"Uquid Coin price today, UQC to USD live price, marketcap and chart ...",https://coinmarketcap.com/currencies/uquid-coin/,"Uquid Coin is down 3.64% in the last 24 hours. The current CoinMarketCap ranking is #411, with a live market cap of $82,393,069 USD. It ..."
Uquid Coin,UQC,UQUID (@uquidcard) / X,https://twitter.com/uquidcard?lang=en,Uquid shopping cart: Online shopping with crypto currencies ... Exciting news for our #Binance Pay users! Join this exclusive ...
Uquid Coin,UQC,Uquid Coin Price: UQC Live Price Chart & News | CoinGecko,https://www.coingecko.com/en/coins/uquid-coin,"Results 1 - 10 of 17 ... Track the latest Uquid Coin price, market cap, trading volume, news and more with CoinGecko's live UQC price ..."
PancakeSwap ,Cake,PancakeSwap: Home,https://pancakeswap.finance/,"2024-02-07. January 2024: PancakeSwap's CAKE Burn. Featured. News. From [Cointelegraph]. Dec 27, 2023. PancakeSwap seeks 300M CAKE token supply revamp."
PancakeSwap ,Cake,PancakeSwap Everyone's Favorite DEX (@PancakeSwap) / X,https://twitter.com/pancakeswap?lang=en,and PancakeSwap's Ambassador. @Smallro_man. to discuss the market trends and PancakeSwap's news Jump in here https://discord.com/invite/pancakeswap…
PancakeSwap ,Cake,"PancakeSwap (CAKE) Price Today, News & Live Chart | Forbes ...",https://www.forbes.com/digital-assets/assets/pancakeswap-cake/,Learn what PancakeSwap (CAKE) cryptocurrency is and today's market price. Confidently invest in cryptocurrency with current and historical PancakeSwap ...
Meta,MTA,Newsroom | Meta,https://about.fb.com/news/,"View the latest news, announcements and media resources from Meta."
Meta,MTA,"Meta Platforms, Inc. (META) Stock Price, News, Quote & History ...",https://finance.yahoo.com/quote/META/,"Find the latest Meta Platforms, Inc. (META) stock quote, history, news and other vital information to help you with your stock trading and investing."
Meta,MTA,"META: Meta Platforms Inc - Stock Price, Quote and News - CNBC",https://www.cnbc.com/quotes/META,"Get Meta Platforms Inc (META:NASDAQ) real-time stock quotes, news, price and financial information from CNBC."
Block-Chain.,BC,"Latest News on AI, Crypto and Blockchain - Blockchain.News",https://blockchain.news/,SEC Gains Upper Hand: Ripple Ordered to Disclose XRP Sales Data · British Columbia Court Upholds Government's Temporary Ban on Cryptocurrency Mining Electricity ...
Block-Chain.,BC,Blockchain Industry News by Cointelegraph,https://cointelegraph.com/tags/blockchain,"Blockchain News · DeFi compliance in 2024, and new SEC rules set to be challenged: Finance Redefined · Governance poses threat to 75% of top tokens — Report."
Block-Chain.,BC,The Block | Latest Blockchain & Cryptocurrency News,https://www.blockchaintechnology-news.com/,"HSBC offers tokenised gold, trials tokenised deposits with Ant blockchain · HSBC. A couple of updates from HSBC have hit the wires: the bank has moved to ..."
Frontier Tok,FRONT,The new frontier in the US war on TikTok: university campuses | US ...,https://www.theguardian.com/us-news/2023/jan/20/us-tiktok-bans-university-campuses,"Jan 20, 2023 ... Experts say banning the app over college networks will not stop students from accessing it over cellular data."
Frontier Tok,FRONT,Government Hasn't Justified a TikTok Ban | Electronic Frontier ...,https://www.eff.org/deeplinks/2023/03/government-hasnt-justified-tiktok-ban,"Mar 16, 2023 ... According to Pew, 67% of U.S. teenagers use Tiktok, and 10% of U.S. adults regularly get news there. Many users choose TikTok over its ..."
Frontier Tok,FRONT,Passenger 'voted' off of Trenton-Atlanta Frontier Airlines flight after ...,https://6abc.com/airplane-fight-frontier-airlines-trenton-to-atlanta-tiktok-video-passenger-voted-off/13209140/,"May 3, 2023 ... A TikTok user captured the fight between a couple, a flight attendant ... Related Topics. TRAVEL · MERCER COUNTY · NEW JERSEY · AIRPORT NEWS · AIR ..."
Jomon Shiba,JSHIBA,"Jomon Shiba price today, JSHIBA to USD live price, marketcap and ...",https://coinmarketcap.com/currencies/jomon-shiba/,About Jomon Shiba ... Jshiba INU is the latest sibling of the INU dog family ready to make its way in the world after being abandoned by ...
Jomon Shiba,JSHIBA,Jōmon $Shiba (@jshibatoken) / X,https://twitter.com/jshibatoken?lang=en,Jōmon $Shiba's posts ; JSHIBA Listed on CMC and you can BUY via Uniswap with any wallet which supports ERC-20 Buy JSHIBA Token here: ...
Jomon Shiba,JSHIBA,"Jomon Shiba JSHIBA Price, Live Charts, and News in United States",https://www.coinbase.com/price/jomon-shiba,"Get the latest price, news, live charts, and market trends about Jomon Shiba. The current price of Jomon Shiba in United States is ..."
Jigstack,STAK,Jigstack DAO (@jigstack) / X,https://twitter.com/jigstack?lang=en,... jigstack || Discord: http://discord.gg/jigstack $stak. DeFi jigstack.org ... Exciting News! We're thrilled to announce the official launch of jWallet ...
Jigstack,STAK,Jigstack Price: STAK Live Price Chart & News | CoinGecko,https://www.coingecko.com/en/coins/jigstack,"Track the latest Jigstack price, market cap, trading volume, news and more with CoinGecko's live STAK price chart and popular cryptocurrency price tracker."
Jigstack,STAK,"Jigstack STAK Price, Live Charts, and News in United States",https://www.coinbase.com/price/jigstack,"May 15, 2021 ... Get the latest price, news, live charts, and market trends about Jigstack. The current price of Jigstack in United States is $0.000039 per ..."
Curve.fi DAI,3Crv,Curve.fi,https://curve.fi/,"Integrations · Donate · Developer Docs · News · Resources · Github. Total Deposits $2,062,152,271. Daily Volume $130,630,624. Crypto Volume Share 13.04%. Llama."
Curve.fi DAI,3Crv,Chainlink Oracles x Curve Pool Tokens,https://news.curve.fi/chainlink-oracles-and-curve-pools/,"Nov 27, 2020 ... ... DAI, USDT and USDC. As such, you would start using the DAI/ETH, USDT/ETH and USDC/ETH Price Feeds from ... Curve.fi News © 2024. Powered by Ghost."
Curve.fi DAI,3Crv,Curve.fi,https://optimism.curve.fi/,"Curve is an exchange liquidity pool on Ethereum designed for: extremely efficient stablecoin trading, low risk, supplemental fee income for liquidity ..."
Polkaswap,PSWAP,Polkaswap | Trade with Style and Freedom (@polkaswap) / X,https://twitter.com/polkaswap?lang=en,... on Demeter Farming Platform! Provide XOR/DOT and get $DEO as a reward! ‍ http://farming.deotoken.io. Image. Polkadot News and 8 others. 3. 60. 116.
Polkaswap,PSWAP,Polkaswap,https://www.reddit.com/r/Polkaswap/,r/Polkaswap: Polkaswap is a liquidity aggregator cross chain AMM DEX designed uniquely for the Polkadot ecosystem and hosted on the SORA 2.0 network…
Polkaswap,PSWAP,Polkaswap — The DEX for the Interoperable Future.,https://polkaswap.io/,"Cross-chain exchange of assets, simple creation and listing of new assets, and the easiest swaps ever. The interoperable future of Polkadot is here and we ..."
Convergence,CONV,News & Events | Convergence,https://www.convergence.finance/news-and-events,"Stay up to date with the latest blended finance news and events, also read about what's going on in the world through a blended finance lens in our blog."
Convergence,CONV,"Convergence – News, Research and Analysis – The Conversation ...",https://theconversation.com/topics/convergence-1786,"Media convergence review is light on detail – and on regulation ... The Federal Government's Convergence Review has released its interim report, recommending the ..."
Convergence,CONV,Convergence: News Production in a Digital Age,https://www.jstor.org/stable/25046061,qualities of content created by media workers. Keywords: convergence; news media; newsroom; journalism; sociology of media; local news. A ...
Unibot,UNIBOT,Unibot (@TeamUnibot) / X,https://twitter.com/teamunibot?lang=en,"Unibot is coming to Solana with a dedicated bot designed with the user in mind and tailor-made for Solana's high speed on-chain trading, leveraging key ..."
Unibot,UNIBOT,Unibot contract $560K exploit crashes token price by more than 40%,https://cointelegraph.com/news/unibot-contract-560-k-exploit-crashes-token-price-40,"Oct 31, 2023 ... ... Unibot contract $560K exploit crashes token price by more than 40%. News. Collect article. Own this piece of history as an NFT. Join us on ..."
Unibot,UNIBOT,"Unibot (UNIBOT) Price Today, News & Live Chart | Forbes Crypto ...",https://www.forbes.com/digital-assets/assets/unibot-unibot/,View Unibot (UNIBOT) cryptocurrency prices and market charts. Stay informed on how much Unibot is worth and evaluate current and historical price ...
OCC,OCC,News Releases | OCC,https://www.occ.gov/news-events/newsroom/news-issuances-by-year/news-releases/index-news-releases.html,News Releases · 2024 · 2023 · 2022 · 2021 · 2020 · 2019 · 2018 · 2017 · 2016 · 2015 · 2014 · 2013 · 2012 · 2011 · 2010 · 2009 ...
OCC,OCC,Newsroom | OCC,https://www.occ.treas.gov/news-events/newsroom/?nr=Alert,Explore OCC news releases and issuances on a wide variety of banking-related topics.
OCC,OCC,News & Events | OCC,https://www.occ.gov/news-events/index-news-events.html,"News & Alerts · News Release; Feb 06, 2024. Federal Bank Regulatory Agencies Seek Comment on Interagency Effort to Reduce Regulatory Burden · News Release; Feb ..."
Polkamarkets,POLK,"Polkamarkets (POLK) Price Today, News & Live Chart | Forbes ...",https://www.forbes.com/digital-assets/assets/polkamarkets-polk/,View Polkamarkets (POLK) cryptocurrency prices and market charts. Stay informed on how much Polkamarkets is worth and evaluate current and historical price ...
Polkamarkets,POLK,Polkamarkets Labs (@polkamarkets) / X,https://twitter.com/polkamarkets?lang=en,"Polkamarkets Labs · @polkamarkets. ·. Jan 25. Big News! We're teaming up with. @observadorpt. to introduce ""Previsómetro"" - a dynamic collaboration where ..."
Polkamarkets,POLK,Polkamarkets - Web3 Prediction Markets for everyone,https://www.polkamarkets.com/,Latest News from Polkamarkets Labs. Stay up to date with our latests ... Polkamarkets Services and POLK Token (POLK) are not available in Excluded Jurisdictions.
STAKE,STAKE,Stake News (@stakenewsindia) • Instagram photos and videos,https://www.instagram.com/stakenewsindia/?hl=en,"5767 Followers, 53 Following, 457 Posts - See Instagram photos and videos from Stake News (@stakenewsindia)"
STAKE,STAKE,Stake News & Blog - Latest Sports & Casino News on Stake,https://stake.com/blog,"Learn about the latest in sports, betting tips, new casino games & announcements on the Stake.com Blog. Get all the latest Stake News all in one place!"
STAKE,STAKE,"Stake News - Latest Sports News, Fixtures and Results",https://stakenews.in/,"Featuring all the latest news, fixtures, results and more. Stake News is the principal partner for Mumbai City F.C. in the Indian Super League (ISL)."
xunii.financ,XUNII,"Xunii Finance price now, Live XUNII price, marketcap, chart, and info ...",https://www.coincarp.com/currencies/xuniifinance/,"Get the latest Xunii Finance (XUNII) USD price, teams, history, news, richest address, wallets and more to help you with your crypto trading and investing."
xunii.financ,XUNII,Division of Environmental Quality (DEQ),https://www.adeq.state.ar.us/,"DEQ protects the air, water and land from the threat of pollution. We strive for environmental quality through programs of regulation, education and ..."
xunii.financ,XUNII,Best- and worst-performing fixed-income funds - InvestmentNews,https://www.investmentnews.com/investing/news/best-and-worst-performing-fixed-income-funds-2-76291,"News · Investing. Best- and worst-performing fixed-income funds. By category, ranked by one-year total returns. October 20, 2018; By John Goff; John Goff."
X,X,X on the App Store,https://apps.apple.com/us/app/x/id333903271,"Feb 1, 2024 ... X Corp. Size: 253.8 MB. Category: News. Compatibility. iPhone: Requires iOS 15.0 or later ..."
X,X,X News Daily (@xDaily) / X,https://twitter.com/xDaily,"Your #1 News source on everything X + https://t.co/rn58CVV9pw | Hit Follow and sign up for notifications! | Contributors: @HXMnCK, @512x512 ..."
X,X,X-37B orbital test vehicle concludes sixth successful mission ...,https://www.spaceforce.mil/News/Article/3217077/x-37b-orbital-test-vehicle-concludes-sixth-successful-mission/,"Nov 12, 2022 ... The sixth mission conducted on-orbit experiments for 908 days. Space Force News · Photo Details / Download Hi-Res."
Centaure Tok,CEN,"Pumpkins, the “centaur” of attention | University of Hawaiʻi System ...",https://www.hawaii.edu/news/2019/10/22/pumpkins-the-centaur-of-attention/,"Oct 22, 2019 ... Pumpkins, the 'centaur' of attention. UH News » Community » Pumpkins, the 'centaur' of… ... Students who took part in the 2019 Pumpkin Esquisse."
Centaure Tok,CEN,Krewe of Centaur | Shreveport LA,https://www.facebook.com/KreweOfCentaur/,Krewe of Centaur. 7.5K likes. 󱞋. 9.3K followers. Tag us all season long ... Thank you KSLA News 12 and KTAL 6/Fox for coming out. May be an image of 2 ...
Centaure Tok,CEN,Centaur - Bessemer Venture Partners,https://www.bvp.com/centaur,News · Wish I Knew · Cloud 100. Products; ChatBVP · Cloud Index · Subscribe · Jobs ... Portfolio Jobs · Twitter · LinkedIn · Instagram · YouTube · TikTok ...
PLANET,PLANET,Planet News: 1961-1967 | City Lights Booksellers & Publishers,https://citylights.com/pocket-poets-series/planet-news-pp-23/,Planet News: 1961-1967 · Howl and Other Poems. Allen Ginsberg Price: $7.95 $5.57 Add to cart · Trip Trap. Jack Kerouac Price: $13.95 $9.77 Add to cart · Howl ...
PLANET,PLANET,Planet News: 1961-1967 (City Lights Pocket Poets Series): Ginsberg ...,https://www.amazon.com/Planet-News-1961-1967-Lights-Pocket/dp/0872860205,"Planet News: 1961-1967 (City Lights Pocket Poets Series) [Ginsberg, Allen] on Amazon.com. *FREE* shipping on qualifying offers. Planet News: 1961-1967 (City ..."
PLANET,PLANET,Planet News: Homepage,https://www.planetnews.info/,Planet News · 10 of the most spectacular acting performances of the 21st century · Horror thriller “Platform” – a thought-provoking story that lays bare ...
Tellor Tribu,TRB,The BonqDAO Hack Explained - Hacken,https://hacken.io/insights/bonqdao-hack/,"Feb 3, 2023 ... ... Tellor Oracle. @hackenhacker, an on-chain analyst and researcher, indicated that Bonq Protocol was exposed to an oracle hack, where the ..."
Tellor Tribu,TRB,Tellor (TRB) Kurs Prognose 2024-2030: Wird der TRB Preis bald ...,https://coinedition.com/de/tellor-trb-preisprognose-2023-2030-wird-der-trb-preis-bald-65-erreichen/,"Jan 3, 2024 ... Coin Edition is an independent digital media company that focuses on news from the blockchain and crypto space."
Tellor Tribu,TRB,Crypto-pépite - Tellor : un nouvel oracle pour la DeFi (Finance ...,https://cryptoast.fr/crypto-pepite-tellor-oracle-defi/,"Jun 5, 2020 ... ... news et articles. Actualités des crypto monnaies, bitcoin, ethereum... Actualités. Toutes nos news par catégories. Formation crypto, des guides ..."
Frax,FRAX,Frax Finance ¤⛓️¤ (@fraxfinance) / X,https://twitter.com/fraxfinance?lang=en,It's time for the Fraxtal launch thread! The most important & consequential release since the dawn of Frax itself in 2020. Fraxtal testnet & mainnet are ...
Frax,FRAX,What is a FRAX? And other pressing questions,https://www.ft.com/content/f172ce7f-f545-4cfe-ae20-21e6409d8a69,"Dec 12, 2023 ... News. Securities. See all quotes matching undefined. Search Close ... FRAX is primarily backed by collateral on the blockchain (on-chain) using ..."
Frax,FRAX,Frax Finance,https://frax.finance/,The world's most innovative decentralized stablecoins and DeFi stablecoin infrastructure.
YAM,YAM,NBC News Author Kimmy Yam,https://www.nbcnews.com/author/kimmy-yam-ncpn1063966,Kimmy Yam is a reporter for NBC Asian America. Latest from Kimmy Yam ...
YAM,YAM,Ultimele ştiri din Moldova - News.yam.md,https://news.yam.md/,"Știri din sute de surse actualizate non-stop. Politic, economic, social si sport."
YAM,YAM,Dr. Yam in the News | Notre Dame of Maryland University,http://www.ndm.edu/about-us/office-president/about-dr-yam/news,Marylou Yam named Notre Dame of Maryland President. Notre Dame of Maryland University announced Thursday that a New Jersey liberal arts college provost known ...
Level01 Toke,LVX,"Level01 price today, LVX to USD live price, marketcap and chart ...",https://coinmarketcap.com/currencies/level01/,Supported wallets. UCID. 5094. Tags. Decentralized Exchange (DEX) Token. CommunityCommunity. NewsNews. AboutAbout. Level01 community. skeleton-white. Level01 ...
Level01 Toke,LVX,[Gamers Nexus] We're Fixing this Anti-Consumer Nightmare ...,https://www.reddit.com/r/hardware/comments/145ccad/gamers_nexus_were_fixing_this_anticonsumer/,"Jun 9, 2023 ... [Gamers Nexus] We're Fixing this Anti-Consumer Nightmare | OpenPleb Sensors & RGB, ft. Wendell from Level1 Techs. News."
Level01 Toke,LVX,Level01 On Why DeFi Is Here To Stay,https://www.webull.com/news/23979955,"Aug 28, 2020 ... For Level01, their LVX token caters to a gigantic derivatives market worth $542 trillion yearly, but without the overt control of any one party."
RevolutionPo,RVP,Daughters of the American Revolution,https://www.dar.org/,The Daughters of the American Revolution is an organization with a deeply rich history while also being truly relevant in today's world.
RevolutionPo,RVP,Our Revolution: HOME,https://ourrevolution.com/,We are America's largest grassroots-funded progressive political organizing group. Bernie Sanders launched Our Revolution to empower each of us to stand up to ...
RevolutionPo,RVP,Lineage2 Revolution on the App Store,https://apps.apple.com/sg/app/lineage2-revolution/id1200727466,"A revolution of mobile games, Lineage 2: Revolution. □ Happy Lunar New Year ... Please check the latest news at the link below. REVOLUTION NEWS. http://forum ..."
Wrapped liqu,wstETH,Liquid Bitcoin Versus Wrapped Bitcoin: A Comparative Analysis ...,https://bitcoinmagazine.com/guides/liquid-vs-wrapped-bitcoin,"Jun 19, 2023 ... Bitcoin Magazine - Bitcoin News, Articles and Expert Insights home ... Liquid-Bitcoin (L-BTC) on Blockstream's Liquid sidechain and wrapped ..."
Wrapped liqu,wstETH,New way to wrap liquid drops could improve drug delivery ...,https://uwaterloo.ca/news/news/new-way-wrap-liquid-drops-could-improve-drug-delivery-0,"Waterloo News · Media University of Waterloo sign. October 22, 2019. New way to wrap liquid drops could improve ... A paper on their work, Encapsulation ..."
Wrapped liqu,wstETH,The University of Sussex scientists advancing liquid electronics ...,https://www.sussex.ac.uk/broadcast/read/57373,"Feb 15, 2022 ... In their research paper published in ACS Nano, the Sussex scientists have built on their previous work to wrap emulsion droplets with graphene ..."
ARC,ARC,ArcNews | News for GIS Users,https://www.esri.com/about/newsroom/arcnews/,"ArcNews provides all that's new, exciting, beneficial, and unique about GIS directly from users. Learn how organizations worldwide are using GIS."
ARC,ARC,News | Star Trek Online | Arc Games,https://www.arcgames.com/en/games/star-trek-online/news,"Explore strange new worlds, seek out new life and new civilizations, and boldly go in this expanding vast universe."
ARC,ARC,News - SCI-Arc,https://www.sciarc.edu/news,"SCI-Arc is a world-renowned center of innovation and one of the nation's few independent architecture schools, offering undergraduate, graduate, ..."
ethersmart,ETM,"EtherSmart price today, ETM to USD live price, marketcap and chart ...",https://coinmarketcap.com/currencies/ethersmart/,EtherSmart price. ETM · EtherSmart community · EtherSmart news · About EtherSmart · Privacy Preference Center.
ethersmart,ETM,"Prezzo, grafici in tempo reale e notizie su EtherSmart ETM in Stati Uniti",https://www.coinbase.com/it/price/ethersmart,"The week's biggest crypto news, sent right to your inbox. Subscribe now. Learn how we collect your information by visiting our Privacy Policy. Il prezzo di ..."
ethersmart,ETM,Convert 1000 ETM to USD (EtherSmart to US Dollar) - BeInCrypto,https://beincrypto.com/convert/ethersmart-to-usd?amount=1000,... ETM to USD Calculator - How much US Dollar (USD) is 1000 EtherSmart (ETM) ... NewsCryptocurrenciesExchangesLearnWeb3 Marketing. Resources. AdvertiseRemote ...
Bounce Token,Auctio,Bounce Brand (@bounce_finance) / X,https://twitter.com/bounce_finance?lang=en,"This week's Bounce Newsletter is out, focusing entirely on the most important Bounce news ... token PoS mechanism, with a CeFi foundation secured by."
Bounce Token,Auctio,"Bounce Token price today, AUCTION to USD live price, marketcap ...",https://coinmarketcap.com/currencies/bounce-token/,... you take certain actions such as signing up and transacting with these affiliate platforms. Please refer to Affiliate Disclosure. Bounce Token news ...
Bounce Token,Auctio,"Bounce Token AUCTION Price, Live Charts, and News in United ...",https://www.coinbase.com/price/bounce-token,"Bounce Token, also known as AUCTION, is a decentralized auction platform that leverages blockchain technology to enhance the auctioning, bidding, and buying ..."
SafeEarth,SAFEEA,Earth is outside its 'safe operating space for humanity' on most key ...,https://apnews.com/article/earth-climate-change-biodiversity-environment-pollution-c8582c3ae0344b5a88cc38cd8e725702,"Sep 13, 2023 ... The Associated Press is an independent global news organization dedicated to factual reporting. Founded in 1846, AP today remains the most ..."
SafeEarth,SAFEEA,A just world on a safe planet: First study quantifying Earth System ...,https://earthcommission.org/news/publications/just-world-safe-planet/,"May 31, 2023 ... Safe and Just (global): 0.15 annual mean interhemispheric AOD difference (safe) ... News – 19/01/2024. Securing Nature's Contributions to… View of ..."
SafeEarth,SAFEEA,"SafeEarth SAFEEARTH Price, Live Charts, and News in United States",https://www.coinbase.com/price/safeearth,"Get the latest price, news, live charts, and market trends about SafeEarth. The current price of SafeEarth in United States is $NaN per (SAFEEARTH / USD)"
Banana,BANANA,The Savannah Bananas,https://thesavannahbananas.com/,"BE FIRST TO KNOW. Sign up to receive the most up to date Banana's news, events, and information."
Banana,BANANA,"Bananas: Benefits, Nutrition, and Risks",https://www.health.com/bananas-8413931,"Jan 10, 2024 ... The banana, scientifically known as Musa acuminata, is a versatile and delicious fruit packed with numerous health benefits."
Banana,BANANA,Diplomatic tensions between Ecuador and Russia threaten banana ...,https://apnews.com/article/ecuador-russia-bananas-military-exports-diplomacy-1c8f21060450b22411af7b6c05e173a3,"5 days ago ... ... banana exports. (AP Photo/Dolores Ochoa, File) ... Founded in 1846, AP today remains the most trusted source of fast, accurate, unbiased news ..."
Launchpool t,LPOOL,Introducing Pixels (PIXEL) on Binance Launchpool! Farm PIXEL by ...,https://www.binance.com/en/support/announcement/introducing-pixels-pixel-on-binance-launchpool-farm-pixel-by-staking-bnb-and-fdusd-c055fa89dda84402b7b662f13b80fffe,"2 days ago ... Fellow Binancians, Binance is excited to announce the 46th project on Binance Launchpool - Pixels (PIXEL) , a social web3 game built on the ..."
Launchpool t,LPOOL,Binance Unveils Fusionist (ACE) as 40th Launchpool Project,https://www.bsc.news/post/binance-unveils-fusionist-ace-as-40th-launchpool-project,"Dec 11, 2023 ... Don't forget to download the BSC News mobile application on iOS and Android to keep up with all the latest news for BNB Chain and crypto."
Launchpool t,LPOOL,Launchpool ($LPOOL) (@LaunchPoolXYZ) / X,https://twitter.com/launchpoolxyz?lang=en,"Jan 16. Big news! Mintlayer is launching its #Mainnet on Jan 29, 2024! This ... t afraid to challenge the status quo. Drop us a comment or a DM, and our ..."
EverMoon,EVERMO,EverMoon (@EverMoonERC) / X,https://twitter.com/EverMoonERC,Unique tokenomics. Empowering community. Historical vision. Let's make history. #EVERMOON.
EverMoon,EVERMO,"EverMoon EVERMOON Price, Live Charts, and News in United States",https://www.coinbase.com/price/evermoon-token,"Get the latest price, news, live charts, and market trends about EverMoon. The current price of EverMoon in United States is $0.000716 per (EVERMOON / USD)"
EverMoon,EVERMO,"EverMoon USD (EVERMOON-USD) Price, Value, News & History ...",https://finance.yahoo.com/quote/EVERMOON-USD/,"Find the latest EverMoon USD (EVERMOON-USD) price quote, history, news and other vital information to help you with your cryptocurrency trading and ..."
RAMP DEFI,RAMP,RAMP DEFI | Unlock Liquid Capital From Staked Assets,https://rampdefi.com/,RAMP DEFI is a multi-chain DeFi protocol that allows users to earn yields on their collateral asset deposits and extract liquidity to pursue new ...
